<?xml version="1.0" encoding="utf-8" ?>
<games xmlns:xsi="http://www.w3.org/2001/XMLSchema-instance"	xsi:noNamespaceSchemaLocation="games.xsd"
	majorVersion="1" minorVersion="0" revisionVersion="0">
	
  <game name="ChronoCross»PS1">
	  <title>Chrono Cross</title>
	  <ps1 prefix="SLUS" suffix="01041" />
	  <ps1 prefix="SLUS" suffix="01080" />
    <contributer>SanMadJack</contributer>
  </game>

  <game name="ChronoTrigger»PS1">
	  <title>Chrono Trigger</title>
	  <ps1 prefix="SLUS" suffix="01363" />
    <contributer>SanMadJack</contributer>
  </game>

  <game name="Descent»PS1">
	  <title>Descent</title>
	  <ps1 prefix="SLUS" suffix="00037" />
    <contributer>SanMadJack</contributer>
  </game>

  <game name="DescentMaximum»PS1.xml">
	  <title>Descent: Maximum</title>
	  <ps1 prefix="SLUS" suffix="00460" />
    <contributer>SanMadJack</contributer>
  </game>

    <game name="FearEffect»PS1">
      <title>Final Fantasy VIII</title>
      <ps1 prefix="SLUS" suffix="00920" />
      <ps1 prefix="SLUS" suffix="01056" />
      <ps1 prefix="SLUS" suffix="01057" />
      <ps1 prefix="SLUS" suffix="01058" />
      <contributer>SanMadJack</contributer>
    </game>

    <game name="FearEffect2»PS1">
      <title>Fear Effect 2: Retro Helix</title>
      <ps1 prefix="SLUS" suffix="01266" />
      <ps1 prefix="SLUS" suffix="01275" />
      <ps1 prefix="SLUS" suffix="01276" />
      <ps1 prefix="SLUS" suffix="01277" />
      <contributer>SanMadJack</contributer>
    </game>
    
    <game name="FinalFantasy4»PS1">
	    <title>Final Fantasy IV</title>
	    <ps1 prefix="SLUS" suffix="01360" />
      <contributer>SanMadJack</contributer>
    </game>

  <game name="FinalFantasy8»PS1">
	  <title>Final Fantasy VIII</title>
	  <ps1 prefix="SLUS" suffix="00892" />
	  <ps1 prefix="SLUS" suffix="00908" />
	  <ps1 prefix="SLUS" suffix="00909" />
	  <ps1 prefix="SLUS" suffix="00910" />
    <contributer>SanMadJack</contributer>
  </game>

  <game name="FinalFantasy9»PS1">
	  <title>Final Fantasy IX</title>
	  <ps1 prefix="SLUS" suffix="01251" />
	  <ps1 prefix="SLUS" suffix="01295" />
	  <ps1 prefix="SLUS" suffix="01296" />
	  <ps1 prefix="SLUS" suffix="01297" />
    <contributer>SanMadJack</contributer>
  </game>

  <game name="FinalFantasyTactics»PS1">
	  <title>Final Fantasy Tactics</title>
	  <ps1 prefix="SLUS" suffix="94221" />
    <contributer>SanMadJack</contributer>
  </game>

  <game name="MetalGearSolid»PS1">
	  <title>Metal Gear Solid</title>
	  <ps1 prefix="SLUS" suffix="00594" />
	  <ps1 prefix="SLUS" suffix="00776" />
    <contributer>SanMadJack</contributer>
  </game>

  <game name="MetalGearSolidVRMissions»PS1">
	  <title>Metal Gear Solid: VR Missions</title>
	  <ps1 prefix="SLUS" suffix="00957" />
    <contributer>SanMadJack</contributer>
  </game>

  <game name="ParasiteEve»PS1">
	  <title>Parasite Eve</title>
	  <ps1 prefix="SLUS" suffix="00662" />
	  <ps1 prefix="SLUS" suffix="00668" />
    <contributer>SanMadJack</contributer>
  </game>

  <game name="ParasiteEve2»PS1">
	  <title>Parasite Eve II</title>
	  <ps1 prefix="SLUS" suffix="01042" />
	  <ps1 prefix="SLUS" suffix="01055" />
    <contributer>SanMadJack</contributer>
  </game>

  <game name="SilentHill»PS1">
	  <title>Silent Hill</title>
	  <ps1 prefix="SLUS" suffix="00707" />
    <contributer>SanMadJack</contributer>
  </game>

  <game name="SoulBlade»PS1">
	  <title>Soul Blade</title>
	  <ps1 prefix="SLUS" suffix="00240" />
    <contributer>SanMadJack</contributer>
  </game>

</games>