<?xml version="1.0" encoding="utf-8"?>
<games xmlns:xsi="http://www.w3.org/2001/XMLSchema-instance"	xsi:noNamespaceSchemaLocation="games.xsd"
	majorVersion="1" minorVersion="0" revisionVersion="0">
	
  <game name="AssassinsCreed»PS3">
		<title>Assassin's Creed</title>
		<ps3 prefix="BLUS" suffix="30089" />
    <contributer>SanMadJack</contributer>
  </game>

  <game name="BattlefieldBadcompany»PS3">
    <title>Battlefield: Bad Company</title>
    <ps3 prefix="BLUS" suffix="30118" />
    <contributer>SanMadJack</contributer>
  </game>

  <game name="BrutalLegend»PS3">
    <title>Brütal Legend</title>
    <ps3 prefix="BLUS" suffix="30330" />
    <contributer>SanMadJack</contributer>
  </game>

  <game name="CivilizationRevolution»PS3">
	  <title>Sid Meier's Civilization: Revolution</title>
	  <ps3 prefix="BLUS" suffix="30130" />
    <contributer>SanMadJack</contributer>
  </game>

  <game name="Darkness»PS3">
	  <title>The Darkness</title>
	  <ps3 prefix="BLUS" suffix="30035" />
    <contributer>SanMadJack</contributer>
  </game>

  <game name="DeadSpace»PS3">
	  <title>Dead Space</title>
	  <ps3 prefix="BLUS" suffix="30177" />
    <contributer>SanMadJack</contributer>
  </game>

  <game name="DevilMayCry4»PS3">
	  <title>Devil May Cry 4</title>
	  <ps3 prefix="BLUS" suffix="30092" />
    <contributer>SanMadJack</contributer>
  </game>

  <game name="Echochrome»PS3">
	  <title>Echochrome</title>
	  <ps3 prefix="NPUA" suffix="80134" />
    <contributer>SanMadJack</contributer>
  </game>

  <game name="ElderScrolls4Oblivion»PS3">
	  <title>Elder Scrolls IV: Oblivion</title>
	  <ps3 prefix="BLUS" suffix="30007" />
    <contributer>SanMadJack</contributer>
  </game>

  <game name="Elefunk»PS3">
	  <title>Elefunk</title>
	  <ps3 prefix="NPUA" suffix="80157" />
    <contributer>SanMadJack</contributer>
  </game>

  <game name="EternalSonata»PS3">
	  <title>Eternal Sonata</title>
	  <ps3 prefix="BLUS" suffix="30161" />
    <contributer>SanMadJack</contributer>
  </game>

  <game name="FinalFantasy13»PS3">
	  <title>Final Fantasy XIII</title>
	  <ps3 prefix="MRTC" suffix="00003" />
    <contributer>SanMadJack</contributer>
  </game>

  <game name="Flow»PS3">
	  <title>Flow</title>
	  <ps3 prefix="NPUA" suffix="80001" />
    <contributer>SanMadJack</contributer>
  </game>

  <game name="Flower»PS3">
	  <title>Flower</title>
	  <ps3 prefix="NPUA" suffix="80083" />
    <contributer>SanMadJack</contributer>
  </game>

  <game name="Folklore»PS3">
	  <title>Folklore</title>
	  <ps3 prefix="BCUS" suffix="98147" />
    <contributer>SanMadJack</contributer>
  </game>

  <game name="HeavenlySword»PS3">
	  <title>Heavenly Sword</title>
	  <ps3 prefix="BCUS" suffix="98132" />
    <contributer>SanMadJack</contributer>
  </game>

  <game name="inFamous»PS3">
	  <title>inFamous</title>
	  <ps3 prefix="BCUS" suffix="98119" />
    <contributer>SanMadJack</contributer>
  </game>

  <game name="Jeopardy»PS3">
	  <title>Jeopardy!</title>
	  <ps3 prefix="NPUA" suffix="80227" />
    <contributer>SanMadJack</contributer>
  </game>

  <game name="Lemmings»PS3">
    <title>Lemmings</title>
    <ps3 prefix="NPUA" suffix="80012" />
    <contributer>SanMadJack</contributer>
  </game>

  <game name="LuminesSupernova»PS3">
    <title>Lumines Supernova</title>
    <ps3 prefix="NPUB" suffix="30048" />
    <contributer>SanMadJack</contributer>
  </game>

  <game name="UltimateAlliance»PS3">
    <title>Ultimate Alliance</title>
    <ps3 prefix="BLUS" suffix="30010" />
    <contributer>SanMadJack</contributer>
  </game>

  <game name="MirrorsEdge»PS3">
	  <title>Mirror's Edge</title>
	  <ps3 prefix="BLUS" suffix="30179" />
    <contributer>SanMadJack</contributer>
  </game>

  <game name="PrinceOfPersia»PS3">
	  <title>Prince of Persia</title>
	  <ps3 prefix="BLUS" suffix="30214" />
    <contributer>SanMadJack</contributer>
  </game>

  <game name="RagDollKungFuFistsOfPlastic»PS3">
	  <title>Rag Doll Kung Fu: Fists of Plastic</title>
	  <ps3 prefix="NPUA" suffix="80217" />
    <contributer>SanMadJack</contributer>
  </game>

  <game name="RatchetClankFutureToolsOfDestruction»PS3">
	  <title>Ratchet &amp; Clank Future: Tools of Destruction</title>
	  <ps3 prefix="BCUS" suffix="98127" />
    <contributer>SanMadJack</contributer>
  </game>

  <game name="RatchetClankFutureQuestForBooty»PS3">
	  <title>Ratchet &amp; Clank Future: Quest For Booty</title>
	  <ps3 prefix="NPUA" suffix="80145" />
    <contributer>SanMadJack</contributer>
  </game>

  <game name="RedFactionGuerrilla»PS3">
	  <title>Red Faction: Guerrilla</title>
	  <ps3 prefix="BLUS" suffix="30258" />
    <contributer>SanMadJack</contributer>
  </game>

  <game name="ResidentEvil5»PS3">
	  <title>Resident Evil 5</title>
	  <ps3 prefix="BLUS" suffix="30270" />
    <contributer>SanMadJack</contributer>
  </game>

  <game name="ResistanceFallOfMan»PS3">
	  <title>Resistance: Fall of Man</title>
	  <ps3 prefix="BCUS" suffix="98107" />
    <contributer>SanMadJack</contributer>
  </game>

  <game name="Resistance2»PS3">
	  <title>Resistance 2</title>
	  <ps3 prefix="BCUS" suffix="98120" />
    <contributer>SanMadJack</contributer>
  </game>

  <game name="SavageMoon»PS3">
	  <title>Savage Moon</title>
	  <ps3 prefix="NPUA" suffix="80228" />
    <contributer>SanMadJack</contributer>
  </game>

  <game name="Shatter»PS3">
    <title>Shatter</title>
    <ps3 prefix="NPUB" suffix="30091" />
    <contributer>SanMadJack</contributer>
  </game>

  <game name="SilentHillHomecoming»PS3">
	  <title>Silent Hill: Homecoming</title>
	  <ps3 prefix="BLUS" suffix="30169" />
    <contributer>SanMadJack</contributer>
  </game>

  <game name="SoulCalibur4»PS3">
	  <title>Soul Calibur IV</title>
	  <ps3 prefix="BLUS" suffix="30160" />
    <contributer>SanMadJack</contributer>
  </game>

  <game name="SuperStardustHD»PS3">
	  <title>Super Stardust HD</title>
	  <ps3 prefix="NPUA" suffix="80068" />
    <contributer>SanMadJack</contributer>
  </game>

  <game name="UnchartedDrakesFortune»PS3">
	  <title>Uncharted: Drake's Fortune</title>
	  <ps3 prefix="BCUS" suffix="98103" />
    <contributer>SanMadJack</contributer>
  </game>

  <game name="UnrealTournament3»PS3">
	  <title>Unreal Tournament III</title>
	  <ps3 prefix="BLUS" suffix="30086" />
    <contributer>SanMadJack</contributer>
  </game>

  <game name="ValkyriaChronicles»PS3">
	  <title>Valkyria Chronicles</title>
	  <ps3 prefix="BLUS" suffix="30196" />
    <contributer>SanMadJack</contributer>
  </game>

  <game name="WheelOfFortune»PS3">
	  <title>Wheel of Fortune</title>
	  <ps3 prefix="NPUA" suffix="80137" />
    <contributer>SanMadJack</contributer>
  </game>

  <game name="Wolfenstein3D»PS3">
	  <title>Wolfenstein 3D</title>
	  <ps3 prefix="NPUB" suffix="30074" />
    <contributer>SanMadJack</contributer>
  </game>

</games>